<?xml version="1.0" encoding="UTF-8" standalone="yes"?>
<eventoCultural xmlns="http://www.um.es/EventoCultural" xmlns:xsi="http://www.w3.org/2001/XMLSchema-instance" id="53384425-1cf5-4f33-88a5-7e77ce4cf76e" xsi:schemaLocation="EventoCultural.xsd">
    <nombre>A la luz de los focos</nombre>
    <tipo>CursosTalleres</tipo>
    <fechaInicio>2021-06-25</fechaInicio>
    <fechaFin>2021-06-25</fechaFin>
    <resumen>Pequeñas dosis de humor de la mano de grandes artistas.   A cargo del alumnado del 'Taller de Teatro del Centro Cultural Sara Montiel'. Profesora: Sara Monge.</resumen>
    <url>http://www.madrid.es/sites/v/index.jsp?vgnextchannel=ca9671ee4a9eb410VgnVCM100000171f5a0aRCRD&amp;vgnextoid=a6b9b6c834e99710VgnVCM2000001f4a900aRCRD</url>
    <localizacion>Centro Cultural Sara Montiel (Latina)</localizacion>
    <coordenadaLongitud>-3.775144917950534</coordenadaLongitud>
    <coordenadaLatitud>40.399764677637116</coordenadaLatitud>
    <actuaciones>
        <frecuencia>WEEKLY</frecuencia>
        <dias></dias>
        <intervalo>1</intervalo>
    </actuaciones>
    <sitiosInteres>
        <titulo>Estación de Ciudad de la Imagen</titulo>
        <resumen>Ciudad de la Imagen es una estación de la línea ML-3 de Metro Ligero Oeste situada en el barrio homónimo de Pozuelo de Alarcón, junto a la calle Juan de Orduña. Abrió al público el 27 de julio de 2007. Su tarifa corresponde a la zona B1 según el Consorcio Regional de Transportes.  (...)</resumen>
        <urlWikipedia>https://es.wikipedia.org/wiki/Estaci%C3%B3n_de_Ciudad_de_la_Imagen</urlWikipedia>
    </sitiosInteres>
</eventoCultural>
