<?xml version="1.0" encoding="UTF-8" standalone="yes"?>
<eventoCultural xmlns="http://www.um.es/EventoCultural" xmlns:xsi="http://www.w3.org/2001/XMLSchema-instance" id="81a290bb-ba32-46b9-80f2-d4bb76e0af55" xsi:schemaLocation="EventoCultural.xsd">
    <nombre>El carro de Federico</nombre>
    <tipo>Fiestas</tipo>
    <fechaInicio>2021-06-27</fechaInicio>
    <fechaFin>2021-06-27</fechaFin>
    <resumen>Cuentacuentos.   Lugar: Plaza Antonio Cumella.   Sinopsis: Federico va de pueblo en pueblo con su carro lleno de cuentos, ero un día llegó a un pueblo donde nadie sabía leer, nadie excepto Don Señorón, ¿Qué pasará con la gente de aquel pueblo? ¿Qué pasará con todos esos cuentos del carro de Federico que esperan ser leídos o contados?  Edad recomendada:  a partir de 5 años.</resumen>
    <url>http://www.madrid.es/sites/v/index.jsp?vgnextchannel=ca9671ee4a9eb410VgnVCM100000171f5a0aRCRD&amp;vgnextoid=5b9de2f4dc2b9710VgnVCM2000001f4a900aRCRD</url>
    <actuaciones>
        <frecuencia>WEEKLY</frecuencia>
        <dias></dias>
        <intervalo>1</intervalo>
    </actuaciones>
</eventoCultural>
