<?xml version="1.0" encoding="UTF-8" standalone="yes"?>
<eventoCultural xmlns="http://www.um.es/EventoCultural" xmlns:xsi="http://www.w3.org/2001/XMLSchema-instance" id="07aa21ae-2fe2-4ee1-8b82-888ac8716450" xsi:schemaLocation="EventoCultural.xsd">
    <nombre>3</nombre>
    <tipo>TeatroPerformance</tipo>
    <fechaInicio>2021-06-11</fechaInicio>
    <fechaFin>2021-06-11</fechaFin>
    <resumen></resumen>
    <url>http://www.madrid.es/sites/v/index.jsp?vgnextchannel=ca9671ee4a9eb410VgnVCM100000171f5a0aRCRD&amp;vgnextoid=af755282f58a9710VgnVCM1000001d4a900aRCRD</url>
    <localizacion>Centro Sociocultural Alberto Sánchez (Puente de Vallecas)</localizacion>
    <coordenadaLongitud>-3.6556073868098493</coordenadaLongitud>
    <coordenadaLatitud>40.393612303425975</coordenadaLatitud>
    <actuaciones>
        <frecuencia>WEEKLY</frecuencia>
        <dias></dias>
        <intervalo>1</intervalo>
    </actuaciones>
    <sitiosInteres>
        <titulo>Portazgo (Madrid)</titulo>
        <resumen>Portazgo es un barrio administrativo de Madrid que se encuentra al norte del distrito de Puente de Vallecas y está delimitado por las siguientes vías: * Avda. Pablo Neruda * C/Pío Felipe * Avda. Buenos Aires * Avda Mediterráneo  (...)</resumen>
        <urlWikipedia>https://es.wikipedia.org/wiki/Portazgo_%28Madrid%29</urlWikipedia>
    </sitiosInteres>
</eventoCultural>
