<?xml version="1.0" encoding="UTF-8" standalone="yes"?>
<eventoCultural xmlns="http://www.um.es/EventoCultural" xmlns:xsi="http://www.w3.org/2001/XMLSchema-instance" id="c8fef96d-3897-4867-8446-09c2a576db94" xsi:schemaLocation="EventoCultural.xsd">
    <nombre>13 Lunas</nombre>
    <tipo>ProgramacionDestacadaAgendaCultura</tipo>
    <fechaInicio>2021-05-26</fechaInicio>
    <fechaFin>2021-05-26</fechaFin>
    <resumen>Menhir (Coco Moya e Iván Cebrián).  Kebyart Ensemble, Cuarteto de Saxofones.  Obras de Igor Stravinsky, Joan Magrané, José Río-Pareja (1973) - Parhelia (2018), 10’ , Franz Schubert, Raquel García-Tomás.</resumen>
    <url>http://www.madrid.es/sites/v/index.jsp?vgnextchannel=ca9671ee4a9eb410VgnVCM100000171f5a0aRCRD&amp;vgnextoid=47efc8f96f587710VgnVCM1000001d4a900aRCRD</url>
    <localizacion>CentroCentro</localizacion>
    <coordenadaLongitud>-3.692206111679657</coordenadaLongitud>
    <coordenadaLatitud>40.419011767401095</coordenadaLatitud>
    <actuaciones>
        <frecuencia>WEEKLY</frecuencia>
        <dias></dias>
        <intervalo>1</intervalo>
    </actuaciones>
    <sitiosInteres>
        <titulo>Campeonato Mundial de Clubes de la FIFA 2001</titulo>
        <resumen>El Campeonato Mundial de Clubes 2001 fue un intento de la segunda edición del torneo organizado por la FIFA que fue cancelado. Estaba planeado que se llevase a cabo en España.  (...)</resumen>
        <urlWikipedia>https://es.wikipedia.org/wiki/Campeonato_Mundial_de_Clubes_de_la_FIFA_2001</urlWikipedia>
    </sitiosInteres>
</eventoCultural>
