<?xml version="1.0" encoding="UTF-8" standalone="yes"?>
<eventoCultural xmlns="http://www.um.es/EventoCultural" xmlns:xsi="http://www.w3.org/2001/XMLSchema-instance" id="5d2c15e1-01a2-4082-8bbc-a788ca2a0d53" xsi:schemaLocation="EventoCultural.xsd">
    <nombre>El campesino y la vaca</nombre>
    <tipo>CuentacuentosTiteresMarionetas</tipo>
    <fechaInicio>2021-06-20</fechaInicio>
    <fechaFin>2021-06-20</fechaFin>
    <resumen>Compañía entre manos.  Títeres.  Una historia que nos cuenta que los más importante no es lo que piensen los demás de nosotros.</resumen>
    <url>http://www.madrid.es/sites/v/index.jsp?vgnextchannel=ca9671ee4a9eb410VgnVCM100000171f5a0aRCRD&amp;vgnextoid=6615091bf32b9710VgnVCM1000001d4a900aRCRD</url>
    <localizacion>Centro Cultural Hortaleza</localizacion>
    <coordenadaLongitud>-3.6420353342333227</coordenadaLongitud>
    <coordenadaLatitud>40.476859845869534</coordenadaLatitud>
    <actuaciones>
        <frecuencia>WEEKLY</frecuencia>
        <dias></dias>
        <intervalo>1</intervalo>
    </actuaciones>
    <sitiosInteres>
        <titulo>Estación de Hortaleza</titulo>
        <resumen>Hortaleza es una estación de la línea 4 del Metro de Madrid situada bajo la calle Virgen del Carmen, en el barrio de Pinar del Rey (distrito Hortaleza).  (...)</resumen>
        <urlWikipedia>https://es.wikipedia.org/wiki/Estaci%C3%B3n_de_Hortaleza</urlWikipedia>
    </sitiosInteres>
</eventoCultural>
